Using device: cuda
[Seed 0] Epoch 001/100 | train_loss=0.4519 | val_loss=0.3269 | val_acc=0.8804
[Seed 0] Epoch 002/100 | train_loss=0.2835 | val_loss=0.2979 | val_acc=0.8926
[Seed 0] Epoch 003/100 | train_loss=0.2576 | val_loss=0.2933 | val_acc=0.8980
[Seed 0] Epoch 004/100 | train_loss=0.2364 | val_loss=0.2508 | val_acc=0.9124
[Seed 0] Epoch 005/100 | train_loss=0.2177 | val_loss=0.2493 | val_acc=0.9108
[Seed 0] Epoch 006/100 | train_loss=0.2049 | val_loss=0.2520 | val_acc=0.9107
[Seed 0] Epoch 007/100 | train_loss=0.1887 | val_loss=0.2629 | val_acc=0.9122
[Seed 0] Epoch 008/100 | train_loss=0.1754 | val_loss=0.2474 | val_acc=0.9153
[Seed 0] Epoch 009/100 | train_loss=0.1579 | val_loss=0.2646 | val_acc=0.9128
[Seed 0] Epoch 010/100 | train_loss=0.1482 | val_loss=0.2546 | val_acc=0.9150
[Seed 0] Epoch 011/100 | train_loss=0.1331 | val_loss=0.2654 | val_acc=0.9150
[Seed 0] Epoch 012/100 | train_loss=0.1221 | val_loss=0.2698 | val_acc=0.9125
[Seed 0] Epoch 013/100 | train_loss=0.1108 | val_loss=0.3025 | val_acc=0.9095
[Seed 0] Epoch 014/100 | train_loss=0.1017 | val_loss=0.2849 | val_acc=0.9133
[Seed 0] Epoch 015/100 | train_loss=0.0887 | val_loss=0.3145 | val_acc=0.9117
[Seed 0] Epoch 016/100 | train_loss=0.0816 | val_loss=0.3220 | val_acc=0.9117
[Seed 0] Epoch 017/100 | train_loss=0.0724 | val_loss=0.3289 | val_acc=0.9134
[Seed 0] Epoch 018/100 | train_loss=0.0684 | val_loss=0.3497 | val_acc=0.9107
[Seed 0] Epoch 019/100 | train_loss=0.0625 | val_loss=0.3476 | val_acc=0.9121
[Seed 0] Epoch 020/100 | train_loss=0.0549 | val_loss=0.3539 | val_acc=0.9093
[Seed 0] Epoch 021/100 | train_loss=0.0512 | val_loss=0.3753 | val_acc=0.9129
[Seed 0] Epoch 022/100 | train_loss=0.0480 | val_loss=0.4093 | val_acc=0.9083
[Seed 0] Epoch 023/100 | train_loss=0.0431 | val_loss=0.4277 | val_acc=0.9084
[Seed 0] Epoch 024/100 | train_loss=0.0409 | val_loss=0.4060 | val_acc=0.9125
[Seed 0] Epoch 025/100 | train_loss=0.0374 | val_loss=0.4246 | val_acc=0.9109
[Seed 0] Epoch 026/100 | train_loss=0.0351 | val_loss=0.4565 | val_acc=0.9037
[Seed 0] Epoch 027/100 | train_loss=0.0325 | val_loss=0.4357 | val_acc=0.9122
[Seed 0] Epoch 028/100 | train_loss=0.0296 | val_loss=0.4451 | val_acc=0.9146
[Seed 0] Epoch 029/100 | train_loss=0.0292 | val_loss=0.4673 | val_acc=0.9108
[Seed 0] Epoch 030/100 | train_loss=0.0287 | val_loss=0.4680 | val_acc=0.9132
[Seed 0] Epoch 031/100 | train_loss=0.0235 | val_loss=0.4801 | val_acc=0.9117
[Seed 0] Epoch 032/100 | train_loss=0.0258 | val_loss=0.4447 | val_acc=0.9146
[Seed 0] Epoch 033/100 | train_loss=0.0260 | val_loss=0.4749 | val_acc=0.9118
[Seed 0] Epoch 034/100 | train_loss=0.0219 | val_loss=0.4778 | val_acc=0.9130
[Seed 0] Epoch 035/100 | train_loss=0.0174 | val_loss=0.5093 | val_acc=0.9128
[Seed 0] Epoch 036/100 | train_loss=0.0218 | val_loss=0.4881 | val_acc=0.9147
[Seed 0] Epoch 037/100 | train_loss=0.0187 | val_loss=0.4743 | val_acc=0.9158
[Seed 0] Epoch 038/100 | train_loss=0.0228 | val_loss=0.4859 | val_acc=0.9101
[Seed 0] Epoch 039/100 | train_loss=0.0160 | val_loss=0.4997 | val_acc=0.9164
[Seed 0] Epoch 040/100 | train_loss=0.0155 | val_loss=0.5244 | val_acc=0.9155
[Seed 0] Epoch 041/100 | train_loss=0.0124 | val_loss=0.5357 | val_acc=0.9155
[Seed 0] Epoch 042/100 | train_loss=0.0145 | val_loss=0.5202 | val_acc=0.9149
[Seed 0] Epoch 043/100 | train_loss=0.0147 | val_loss=0.5525 | val_acc=0.9108
[Seed 0] Epoch 044/100 | train_loss=0.0138 | val_loss=0.5522 | val_acc=0.9120
[Seed 0] Epoch 045/100 | train_loss=0.0133 | val_loss=0.5395 | val_acc=0.9129
[Seed 0] Epoch 046/100 | train_loss=0.0138 | val_loss=0.5145 | val_acc=0.9108
[Seed 0] Epoch 047/100 | train_loss=0.0118 | val_loss=0.5217 | val_acc=0.9133
[Seed 0] Epoch 048/100 | train_loss=0.0110 | val_loss=0.5434 | val_acc=0.9153
[Seed 0] Epoch 049/100 | train_loss=0.0106 | val_loss=0.5416 | val_acc=0.9155
[Seed 0] Epoch 050/100 | train_loss=0.0079 | val_loss=0.5748 | val_acc=0.9167
[Seed 0] Epoch 051/100 | train_loss=0.0083 | val_loss=0.5419 | val_acc=0.9159
[Seed 0] Epoch 052/100 | train_loss=0.0071 | val_loss=0.5629 | val_acc=0.9163
[Seed 0] Epoch 053/100 | train_loss=0.0069 | val_loss=0.5956 | val_acc=0.9151
[Seed 0] Epoch 054/100 | train_loss=0.0094 | val_loss=0.5805 | val_acc=0.9163
[Seed 0] Epoch 055/100 | train_loss=0.0078 | val_loss=0.5857 | val_acc=0.9146
[Seed 0] Epoch 056/100 | train_loss=0.0060 | val_loss=0.5854 | val_acc=0.9168
[Seed 0] Epoch 057/100 | train_loss=0.0058 | val_loss=0.5793 | val_acc=0.9167
[Seed 0] Epoch 058/100 | train_loss=0.0076 | val_loss=0.5903 | val_acc=0.9179
[Seed 0] Epoch 059/100 | train_loss=0.0064 | val_loss=0.5772 | val_acc=0.9157
[Seed 0] Epoch 060/100 | train_loss=0.0064 | val_loss=0.5729 | val_acc=0.9187
[Seed 0] Epoch 061/100 | train_loss=0.0046 | val_loss=0.6087 | val_acc=0.9157
[Seed 0] Epoch 062/100 | train_loss=0.0058 | val_loss=0.5912 | val_acc=0.9167
[Seed 0] Epoch 063/100 | train_loss=0.0043 | val_loss=0.5957 | val_acc=0.9162
[Seed 0] Epoch 064/100 | train_loss=0.0050 | val_loss=0.6158 | val_acc=0.9183
[Seed 0] Epoch 065/100 | train_loss=0.0038 | val_loss=0.6150 | val_acc=0.9179
[Seed 0] Epoch 066/100 | train_loss=0.0038 | val_loss=0.6085 | val_acc=0.9166
[Seed 0] Epoch 067/100 | train_loss=0.0034 | val_loss=0.6077 | val_acc=0.9162
[Seed 0] Epoch 068/100 | train_loss=0.0035 | val_loss=0.6108 | val_acc=0.9182
[Seed 0] Epoch 069/100 | train_loss=0.0031 | val_loss=0.6255 | val_acc=0.9154
[Seed 0] Epoch 070/100 | train_loss=0.0031 | val_loss=0.6256 | val_acc=0.9170
[Seed 0] Epoch 071/100 | train_loss=0.0028 | val_loss=0.6220 | val_acc=0.9180
[Seed 0] Epoch 072/100 | train_loss=0.0029 | val_loss=0.6426 | val_acc=0.9163
[Seed 0] Epoch 073/100 | train_loss=0.0024 | val_loss=0.6303 | val_acc=0.9179
[Seed 0] Epoch 074/100 | train_loss=0.0022 | val_loss=0.6370 | val_acc=0.9182
[Seed 0] Epoch 075/100 | train_loss=0.0023 | val_loss=0.6378 | val_acc=0.9180
[Seed 0] Epoch 076/100 | train_loss=0.0025 | val_loss=0.6309 | val_acc=0.9191
[Seed 0] Epoch 077/100 | train_loss=0.0021 | val_loss=0.6328 | val_acc=0.9195
[Seed 0] Epoch 078/100 | train_loss=0.0020 | val_loss=0.6247 | val_acc=0.9195
[Seed 0] Epoch 079/100 | train_loss=0.0020 | val_loss=0.6472 | val_acc=0.9180
[Seed 0] Epoch 080/100 | train_loss=0.0018 | val_loss=0.6358 | val_acc=0.9199
[Seed 0] Epoch 081/100 | train_loss=0.0017 | val_loss=0.6556 | val_acc=0.9175
[Seed 0] Epoch 082/100 | train_loss=0.0017 | val_loss=0.6434 | val_acc=0.9186
[Seed 0] Epoch 083/100 | train_loss=0.0015 | val_loss=0.6465 | val_acc=0.9197
[Seed 0] Epoch 084/100 | train_loss=0.0012 | val_loss=0.6412 | val_acc=0.9179
[Seed 0] Epoch 085/100 | train_loss=0.0015 | val_loss=0.6531 | val_acc=0.9184
[Seed 0] Epoch 086/100 | train_loss=0.0016 | val_loss=0.6551 | val_acc=0.9178
[Seed 0] Epoch 087/100 | train_loss=0.0011 | val_loss=0.6540 | val_acc=0.9183
[Seed 0] Epoch 088/100 | train_loss=0.0013 | val_loss=0.6560 | val_acc=0.9197
[Seed 0] Epoch 089/100 | train_loss=0.0012 | val_loss=0.6560 | val_acc=0.9192
[Seed 0] Epoch 090/100 | train_loss=0.0012 | val_loss=0.6562 | val_acc=0.9186
[Seed 0] Epoch 091/100 | train_loss=0.0012 | val_loss=0.6541 | val_acc=0.9195
[Seed 0] Epoch 092/100 | train_loss=0.0011 | val_loss=0.6562 | val_acc=0.9191
[Seed 0] Epoch 093/100 | train_loss=0.0012 | val_loss=0.6551 | val_acc=0.9184
[Seed 0] Epoch 094/100 | train_loss=0.0011 | val_loss=0.6579 | val_acc=0.9191
[Seed 0] Epoch 095/100 | train_loss=0.0011 | val_loss=0.6527 | val_acc=0.9187
[Seed 0] Epoch 096/100 | train_loss=0.0010 | val_loss=0.6542 | val_acc=0.9187
[Seed 0] Epoch 097/100 | train_loss=0.0011 | val_loss=0.6539 | val_acc=0.9184
[Seed 0] Epoch 098/100 | train_loss=0.0011 | val_loss=0.6541 | val_acc=0.9186
[Seed 0] Epoch 099/100 | train_loss=0.0010 | val_loss=0.6538 | val_acc=0.9187
[Seed 0] Epoch 100/100 | train_loss=0.0010 | val_loss=0.6539 | val_acc=0.9187
Seed 0 finished: best_val=0.9199, time=2.37 min
[Seed 1] Epoch 001/100 | train_loss=0.4452 | val_loss=0.3087 | val_acc=0.8897
[Seed 1] Epoch 002/100 | train_loss=0.2830 | val_loss=0.2776 | val_acc=0.9030
[Seed 1] Epoch 003/100 | train_loss=0.2576 | val_loss=0.2668 | val_acc=0.9047
[Seed 1] Epoch 004/100 | train_loss=0.2368 | val_loss=0.2703 | val_acc=0.9047
[Seed 1] Epoch 005/100 | train_loss=0.2196 | val_loss=0.2619 | val_acc=0.9086
[Seed 1] Epoch 006/100 | train_loss=0.2014 | val_loss=0.2516 | val_acc=0.9105
[Seed 1] Epoch 007/100 | train_loss=0.1884 | val_loss=0.2499 | val_acc=0.9151
[Seed 1] Epoch 008/100 | train_loss=0.1728 | val_loss=0.2543 | val_acc=0.9153
[Seed 1] Epoch 009/100 | train_loss=0.1598 | val_loss=0.2608 | val_acc=0.9126
[Seed 1] Epoch 010/100 | train_loss=0.1438 | val_loss=0.2702 | val_acc=0.9108
[Seed 1] Epoch 011/100 | train_loss=0.1327 | val_loss=0.2728 | val_acc=0.9113
[Seed 1] Epoch 012/100 | train_loss=0.1185 | val_loss=0.2820 | val_acc=0.9134
[Seed 1] Epoch 013/100 | train_loss=0.1053 | val_loss=0.3139 | val_acc=0.9118
[Seed 1] Epoch 014/100 | train_loss=0.0990 | val_loss=0.3559 | val_acc=0.9038
[Seed 1] Epoch 015/100 | train_loss=0.0943 | val_loss=0.3286 | val_acc=0.9097
[Seed 1] Epoch 016/100 | train_loss=0.0819 | val_loss=0.3273 | val_acc=0.9118
[Seed 1] Epoch 017/100 | train_loss=0.0714 | val_loss=0.3535 | val_acc=0.9111
[Seed 1] Epoch 018/100 | train_loss=0.0646 | val_loss=0.3700 | val_acc=0.9080
[Seed 1] Epoch 019/100 | train_loss=0.0603 | val_loss=0.3573 | val_acc=0.9109
[Seed 1] Epoch 020/100 | train_loss=0.0587 | val_loss=0.3810 | val_acc=0.9100
[Seed 1] Epoch 021/100 | train_loss=0.0521 | val_loss=0.4153 | val_acc=0.9099
[Seed 1] Epoch 022/100 | train_loss=0.0435 | val_loss=0.4344 | val_acc=0.9059
[Seed 1] Epoch 023/100 | train_loss=0.0478 | val_loss=0.4039 | val_acc=0.9101
[Seed 1] Epoch 024/100 | train_loss=0.0383 | val_loss=0.4695 | val_acc=0.9078
[Seed 1] Epoch 025/100 | train_loss=0.0389 | val_loss=0.4261 | val_acc=0.9082
[Seed 1] Epoch 026/100 | train_loss=0.0361 | val_loss=0.4515 | val_acc=0.9116
[Seed 1] Epoch 027/100 | train_loss=0.0322 | val_loss=0.4499 | val_acc=0.9157
[Seed 1] Epoch 028/100 | train_loss=0.0300 | val_loss=0.4869 | val_acc=0.9108
[Seed 1] Epoch 029/100 | train_loss=0.0300 | val_loss=0.4649 | val_acc=0.9142
[Seed 1] Epoch 030/100 | train_loss=0.0257 | val_loss=0.4827 | val_acc=0.9136
[Seed 1] Epoch 031/100 | train_loss=0.0242 | val_loss=0.4966 | val_acc=0.9124
[Seed 1] Epoch 032/100 | train_loss=0.0209 | val_loss=0.4776 | val_acc=0.9122
[Seed 1] Epoch 033/100 | train_loss=0.0207 | val_loss=0.4890 | val_acc=0.9113
[Seed 1] Epoch 034/100 | train_loss=0.0211 | val_loss=0.5134 | val_acc=0.9122
[Seed 1] Epoch 035/100 | train_loss=0.0203 | val_loss=0.4991 | val_acc=0.9126
[Seed 1] Epoch 036/100 | train_loss=0.0191 | val_loss=0.5002 | val_acc=0.9120
[Seed 1] Epoch 037/100 | train_loss=0.0210 | val_loss=0.5169 | val_acc=0.9137
[Seed 1] Epoch 038/100 | train_loss=0.0157 | val_loss=0.5404 | val_acc=0.9142
[Seed 1] Epoch 039/100 | train_loss=0.0165 | val_loss=0.5260 | val_acc=0.9155
[Seed 1] Epoch 040/100 | train_loss=0.0147 | val_loss=0.5340 | val_acc=0.9167
[Seed 1] Epoch 041/100 | train_loss=0.0152 | val_loss=0.5293 | val_acc=0.9133
[Seed 1] Epoch 042/100 | train_loss=0.0122 | val_loss=0.5596 | val_acc=0.9143
[Seed 1] Epoch 043/100 | train_loss=0.0140 | val_loss=0.5673 | val_acc=0.9153
[Seed 1] Epoch 044/100 | train_loss=0.0140 | val_loss=0.5621 | val_acc=0.9133
[Seed 1] Epoch 045/100 | train_loss=0.0156 | val_loss=0.5573 | val_acc=0.9157
[Seed 1] Epoch 046/100 | train_loss=0.0137 | val_loss=0.5424 | val_acc=0.9133
[Seed 1] Epoch 047/100 | train_loss=0.0101 | val_loss=0.5602 | val_acc=0.9178
[Seed 1] Epoch 048/100 | train_loss=0.0087 | val_loss=0.5821 | val_acc=0.9154
[Seed 1] Epoch 049/100 | train_loss=0.0089 | val_loss=0.5788 | val_acc=0.9121
[Seed 1] Epoch 050/100 | train_loss=0.0090 | val_loss=0.6070 | val_acc=0.9120
[Seed 1] Epoch 051/100 | train_loss=0.0090 | val_loss=0.6061 | val_acc=0.9186
[Seed 1] Epoch 052/100 | train_loss=0.0089 | val_loss=0.5822 | val_acc=0.9151
[Seed 1] Epoch 053/100 | train_loss=0.0081 | val_loss=0.6119 | val_acc=0.9168
[Seed 1] Epoch 054/100 | train_loss=0.0072 | val_loss=0.5994 | val_acc=0.9159
[Seed 1] Epoch 055/100 | train_loss=0.0077 | val_loss=0.5999 | val_acc=0.9154
[Seed 1] Epoch 056/100 | train_loss=0.0076 | val_loss=0.6263 | val_acc=0.9158
[Seed 1] Epoch 057/100 | train_loss=0.0067 | val_loss=0.6020 | val_acc=0.9178
[Seed 1] Epoch 058/100 | train_loss=0.0052 | val_loss=0.6067 | val_acc=0.9162
[Seed 1] Epoch 059/100 | train_loss=0.0059 | val_loss=0.6291 | val_acc=0.9164
[Seed 1] Epoch 060/100 | train_loss=0.0054 | val_loss=0.6372 | val_acc=0.9159
[Seed 1] Epoch 061/100 | train_loss=0.0046 | val_loss=0.6269 | val_acc=0.9175
[Seed 1] Epoch 062/100 | train_loss=0.0049 | val_loss=0.6449 | val_acc=0.9171
[Seed 1] Epoch 063/100 | train_loss=0.0049 | val_loss=0.6507 | val_acc=0.9170
[Seed 1] Epoch 064/100 | train_loss=0.0044 | val_loss=0.6439 | val_acc=0.9176
[Seed 1] Epoch 065/100 | train_loss=0.0040 | val_loss=0.6180 | val_acc=0.9178
[Seed 1] Epoch 066/100 | train_loss=0.0042 | val_loss=0.6325 | val_acc=0.9174
[Seed 1] Epoch 067/100 | train_loss=0.0033 | val_loss=0.6387 | val_acc=0.9180
[Seed 1] Epoch 068/100 | train_loss=0.0031 | val_loss=0.6368 | val_acc=0.9182
[Seed 1] Epoch 069/100 | train_loss=0.0032 | val_loss=0.6502 | val_acc=0.9171
[Seed 1] Epoch 070/100 | train_loss=0.0031 | val_loss=0.6557 | val_acc=0.9184
[Seed 1] Epoch 071/100 | train_loss=0.0028 | val_loss=0.6433 | val_acc=0.9186
[Seed 1] Epoch 072/100 | train_loss=0.0029 | val_loss=0.6564 | val_acc=0.9176
[Seed 1] Epoch 073/100 | train_loss=0.0033 | val_loss=0.6344 | val_acc=0.9159
[Seed 1] Epoch 074/100 | train_loss=0.0026 | val_loss=0.6464 | val_acc=0.9191
[Seed 1] Epoch 075/100 | train_loss=0.0025 | val_loss=0.6620 | val_acc=0.9175
[Seed 1] Epoch 076/100 | train_loss=0.0023 | val_loss=0.6696 | val_acc=0.9179
[Seed 1] Epoch 077/100 | train_loss=0.0025 | val_loss=0.6484 | val_acc=0.9178
[Seed 1] Epoch 078/100 | train_loss=0.0018 | val_loss=0.6790 | val_acc=0.9170
[Seed 1] Epoch 079/100 | train_loss=0.0018 | val_loss=0.6762 | val_acc=0.9178
[Seed 1] Epoch 080/100 | train_loss=0.0019 | val_loss=0.6517 | val_acc=0.9182
[Seed 1] Epoch 081/100 | train_loss=0.0019 | val_loss=0.6648 | val_acc=0.9174
[Seed 1] Epoch 082/100 | train_loss=0.0017 | val_loss=0.6708 | val_acc=0.9172
[Seed 1] Epoch 083/100 | train_loss=0.0017 | val_loss=0.6628 | val_acc=0.9191
[Seed 1] Epoch 084/100 | train_loss=0.0015 | val_loss=0.6704 | val_acc=0.9191
[Seed 1] Epoch 085/100 | train_loss=0.0015 | val_loss=0.6659 | val_acc=0.9182
[Seed 1] Epoch 086/100 | train_loss=0.0016 | val_loss=0.6716 | val_acc=0.9176
[Seed 1] Epoch 087/100 | train_loss=0.0015 | val_loss=0.6680 | val_acc=0.9201
[Seed 1] Epoch 088/100 | train_loss=0.0014 | val_loss=0.6699 | val_acc=0.9183
[Seed 1] Epoch 089/100 | train_loss=0.0014 | val_loss=0.6700 | val_acc=0.9192
[Seed 1] Epoch 090/100 | train_loss=0.0014 | val_loss=0.6691 | val_acc=0.9180
[Seed 1] Epoch 091/100 | train_loss=0.0013 | val_loss=0.6705 | val_acc=0.9187
[Seed 1] Epoch 092/100 | train_loss=0.0011 | val_loss=0.6714 | val_acc=0.9192
[Seed 1] Epoch 093/100 | train_loss=0.0013 | val_loss=0.6750 | val_acc=0.9189
[Seed 1] Epoch 094/100 | train_loss=0.0012 | val_loss=0.6714 | val_acc=0.9191
[Seed 1] Epoch 095/100 | train_loss=0.0012 | val_loss=0.6744 | val_acc=0.9187
[Seed 1] Epoch 096/100 | train_loss=0.0011 | val_loss=0.6758 | val_acc=0.9192
[Seed 1] Epoch 097/100 | train_loss=0.0011 | val_loss=0.6768 | val_acc=0.9191
[Seed 1] Epoch 098/100 | train_loss=0.0012 | val_loss=0.6769 | val_acc=0.9196
[Seed 1] Epoch 099/100 | train_loss=0.0011 | val_loss=0.6770 | val_acc=0.9196
[Seed 1] Epoch 100/100 | train_loss=0.0011 | val_loss=0.6770 | val_acc=0.9196
Seed 1 finished: best_val=0.9201, time=2.35 min
[Seed 2] Epoch 001/100 | train_loss=0.4487 | val_loss=0.3084 | val_acc=0.8897
[Seed 2] Epoch 002/100 | train_loss=0.2868 | val_loss=0.2784 | val_acc=0.9017
[Seed 2] Epoch 003/100 | train_loss=0.2582 | val_loss=0.2942 | val_acc=0.8936
[Seed 2] Epoch 004/100 | train_loss=0.2378 | val_loss=0.2528 | val_acc=0.9092
[Seed 2] Epoch 005/100 | train_loss=0.2170 | val_loss=0.2518 | val_acc=0.9093
[Seed 2] Epoch 006/100 | train_loss=0.2028 | val_loss=0.2610 | val_acc=0.9114
[Seed 2] Epoch 007/100 | train_loss=0.1888 | val_loss=0.2596 | val_acc=0.9100
[Seed 2] Epoch 008/100 | train_loss=0.1751 | val_loss=0.2580 | val_acc=0.9139
[Seed 2] Epoch 009/100 | train_loss=0.1604 | val_loss=0.2617 | val_acc=0.9114
[Seed 2] Epoch 010/100 | train_loss=0.1461 | val_loss=0.3030 | val_acc=0.8996
[Seed 2] Epoch 011/100 | train_loss=0.1327 | val_loss=0.3006 | val_acc=0.9104
[Seed 2] Epoch 012/100 | train_loss=0.1209 | val_loss=0.2867 | val_acc=0.9120
[Seed 2] Epoch 013/100 | train_loss=0.1090 | val_loss=0.2897 | val_acc=0.9116
[Seed 2] Epoch 014/100 | train_loss=0.1010 | val_loss=0.2931 | val_acc=0.9157
[Seed 2] Epoch 015/100 | train_loss=0.0900 | val_loss=0.3152 | val_acc=0.9146
[Seed 2] Epoch 016/100 | train_loss=0.0850 | val_loss=0.3324 | val_acc=0.9100
[Seed 2] Epoch 017/100 | train_loss=0.0777 | val_loss=0.3415 | val_acc=0.9163
[Seed 2] Epoch 018/100 | train_loss=0.0695 | val_loss=0.3420 | val_acc=0.9132
[Seed 2] Epoch 019/100 | train_loss=0.0585 | val_loss=0.3712 | val_acc=0.9117
[Seed 2] Epoch 020/100 | train_loss=0.0583 | val_loss=0.3730 | val_acc=0.9159
[Seed 2] Epoch 021/100 | train_loss=0.0510 | val_loss=0.3896 | val_acc=0.9161
[Seed 2] Epoch 022/100 | train_loss=0.0490 | val_loss=0.3970 | val_acc=0.9149
[Seed 2] Epoch 023/100 | train_loss=0.0474 | val_loss=0.3930 | val_acc=0.9159
[Seed 2] Epoch 024/100 | train_loss=0.0387 | val_loss=0.4095 | val_acc=0.9139
[Seed 2] Epoch 025/100 | train_loss=0.0365 | val_loss=0.4258 | val_acc=0.9157
[Seed 2] Epoch 026/100 | train_loss=0.0357 | val_loss=0.4220 | val_acc=0.9166
[Seed 2] Epoch 027/100 | train_loss=0.0399 | val_loss=0.4646 | val_acc=0.9099
[Seed 2] Epoch 028/100 | train_loss=0.0352 | val_loss=0.4228 | val_acc=0.9168
[Seed 2] Epoch 029/100 | train_loss=0.0273 | val_loss=0.4758 | val_acc=0.9172
[Seed 2] Epoch 030/100 | train_loss=0.0274 | val_loss=0.4749 | val_acc=0.9146
[Seed 2] Epoch 031/100 | train_loss=0.0244 | val_loss=0.4644 | val_acc=0.9145
[Seed 2] Epoch 032/100 | train_loss=0.0225 | val_loss=0.4872 | val_acc=0.9176
[Seed 2] Epoch 033/100 | train_loss=0.0247 | val_loss=0.4647 | val_acc=0.9134
[Seed 2] Epoch 034/100 | train_loss=0.0217 | val_loss=0.5013 | val_acc=0.9154
[Seed 2] Epoch 035/100 | train_loss=0.0196 | val_loss=0.4874 | val_acc=0.9172
[Seed 2] Epoch 036/100 | train_loss=0.0214 | val_loss=0.4960 | val_acc=0.9143
[Seed 2] Epoch 037/100 | train_loss=0.0217 | val_loss=0.5110 | val_acc=0.9137
[Seed 2] Epoch 038/100 | train_loss=0.0155 | val_loss=0.5109 | val_acc=0.9174
[Seed 2] Epoch 039/100 | train_loss=0.0159 | val_loss=0.5242 | val_acc=0.9137
[Seed 2] Epoch 040/100 | train_loss=0.0145 | val_loss=0.5145 | val_acc=0.9164
[Seed 2] Epoch 041/100 | train_loss=0.0149 | val_loss=0.5414 | val_acc=0.9167
[Seed 2] Epoch 042/100 | train_loss=0.0157 | val_loss=0.5270 | val_acc=0.9166
[Seed 2] Epoch 043/100 | train_loss=0.0136 | val_loss=0.5233 | val_acc=0.9154
[Seed 2] Epoch 044/100 | train_loss=0.0121 | val_loss=0.5533 | val_acc=0.9130
[Seed 2] Epoch 045/100 | train_loss=0.0127 | val_loss=0.5595 | val_acc=0.9174
[Seed 2] Epoch 046/100 | train_loss=0.0132 | val_loss=0.5228 | val_acc=0.9134
[Seed 2] Epoch 047/100 | train_loss=0.0109 | val_loss=0.5459 | val_acc=0.9183
[Seed 2] Epoch 048/100 | train_loss=0.0130 | val_loss=0.5520 | val_acc=0.9175
[Seed 2] Epoch 049/100 | train_loss=0.0093 | val_loss=0.5854 | val_acc=0.9174
[Seed 2] Epoch 050/100 | train_loss=0.0104 | val_loss=0.5738 | val_acc=0.9183
[Seed 2] Epoch 051/100 | train_loss=0.0096 | val_loss=0.5713 | val_acc=0.9191
[Seed 2] Epoch 052/100 | train_loss=0.0086 | val_loss=0.5511 | val_acc=0.9193
[Seed 2] Epoch 053/100 | train_loss=0.0095 | val_loss=0.5612 | val_acc=0.9186
[Seed 2] Epoch 054/100 | train_loss=0.0081 | val_loss=0.5819 | val_acc=0.9168
[Seed 2] Epoch 055/100 | train_loss=0.0077 | val_loss=0.5890 | val_acc=0.9146
[Seed 2] Epoch 056/100 | train_loss=0.0075 | val_loss=0.6025 | val_acc=0.9186
[Seed 2] Epoch 057/100 | train_loss=0.0075 | val_loss=0.5901 | val_acc=0.9174
[Seed 2] Epoch 058/100 | train_loss=0.0057 | val_loss=0.5942 | val_acc=0.9180
[Seed 2] Epoch 059/100 | train_loss=0.0062 | val_loss=0.5851 | val_acc=0.9197
[Seed 2] Epoch 060/100 | train_loss=0.0049 | val_loss=0.6098 | val_acc=0.9176
[Seed 2] Epoch 061/100 | train_loss=0.0050 | val_loss=0.6322 | val_acc=0.9183
[Seed 2] Epoch 062/100 | train_loss=0.0046 | val_loss=0.6240 | val_acc=0.9186
[Seed 2] Epoch 063/100 | train_loss=0.0046 | val_loss=0.6202 | val_acc=0.9180
[Seed 2] Epoch 064/100 | train_loss=0.0045 | val_loss=0.6107 | val_acc=0.9184
[Seed 2] Epoch 065/100 | train_loss=0.0047 | val_loss=0.6036 | val_acc=0.9187
[Seed 2] Epoch 066/100 | train_loss=0.0038 | val_loss=0.6360 | val_acc=0.9191
[Seed 2] Epoch 067/100 | train_loss=0.0035 | val_loss=0.6177 | val_acc=0.9189
[Seed 2] Epoch 068/100 | train_loss=0.0032 | val_loss=0.6444 | val_acc=0.9213
[Seed 2] Epoch 069/100 | train_loss=0.0031 | val_loss=0.6199 | val_acc=0.9208
[Seed 2] Epoch 070/100 | train_loss=0.0035 | val_loss=0.6234 | val_acc=0.9208
[Seed 2] Epoch 071/100 | train_loss=0.0028 | val_loss=0.6429 | val_acc=0.9201
[Seed 2] Epoch 072/100 | train_loss=0.0039 | val_loss=0.6371 | val_acc=0.9204
[Seed 2] Epoch 073/100 | train_loss=0.0029 | val_loss=0.6310 | val_acc=0.9191
[Seed 2] Epoch 074/100 | train_loss=0.0027 | val_loss=0.6458 | val_acc=0.9213
[Seed 2] Epoch 075/100 | train_loss=0.0024 | val_loss=0.6459 | val_acc=0.9196
[Seed 2] Epoch 076/100 | train_loss=0.0024 | val_loss=0.6455 | val_acc=0.9209
[Seed 2] Epoch 077/100 | train_loss=0.0019 | val_loss=0.6530 | val_acc=0.9203
[Seed 2] Epoch 078/100 | train_loss=0.0019 | val_loss=0.6390 | val_acc=0.9204
[Seed 2] Epoch 079/100 | train_loss=0.0018 | val_loss=0.6547 | val_acc=0.9218
[Seed 2] Epoch 080/100 | train_loss=0.0016 | val_loss=0.6442 | val_acc=0.9208
[Seed 2] Epoch 081/100 | train_loss=0.0018 | val_loss=0.6697 | val_acc=0.9209
[Seed 2] Epoch 082/100 | train_loss=0.0017 | val_loss=0.6678 | val_acc=0.9200
[Seed 2] Epoch 083/100 | train_loss=0.0015 | val_loss=0.6586 | val_acc=0.9204
[Seed 2] Epoch 084/100 | train_loss=0.0017 | val_loss=0.6643 | val_acc=0.9203
[Seed 2] Epoch 085/100 | train_loss=0.0018 | val_loss=0.6671 | val_acc=0.9211
[Seed 2] Epoch 086/100 | train_loss=0.0016 | val_loss=0.6657 | val_acc=0.9204
[Seed 2] Epoch 087/100 | train_loss=0.0013 | val_loss=0.6656 | val_acc=0.9200
[Seed 2] Epoch 088/100 | train_loss=0.0013 | val_loss=0.6728 | val_acc=0.9203
[Seed 2] Epoch 089/100 | train_loss=0.0014 | val_loss=0.6696 | val_acc=0.9201
[Seed 2] Epoch 090/100 | train_loss=0.0012 | val_loss=0.6713 | val_acc=0.9207
[Seed 2] Epoch 091/100 | train_loss=0.0011 | val_loss=0.6714 | val_acc=0.9213
[Seed 2] Epoch 092/100 | train_loss=0.0010 | val_loss=0.6728 | val_acc=0.9212
[Seed 2] Epoch 093/100 | train_loss=0.0012 | val_loss=0.6714 | val_acc=0.9205
[Seed 2] Epoch 094/100 | train_loss=0.0012 | val_loss=0.6715 | val_acc=0.9207
[Seed 2] Epoch 095/100 | train_loss=0.0011 | val_loss=0.6741 | val_acc=0.9208
[Seed 2] Epoch 096/100 | train_loss=0.0012 | val_loss=0.6746 | val_acc=0.9209
[Seed 2] Epoch 097/100 | train_loss=0.0010 | val_loss=0.6742 | val_acc=0.9208
[Seed 2] Epoch 098/100 | train_loss=0.0010 | val_loss=0.6748 | val_acc=0.9212
[Seed 2] Epoch 099/100 | train_loss=0.0010 | val_loss=0.6750 | val_acc=0.9212
[Seed 2] Epoch 100/100 | train_loss=0.0010 | val_loss=0.6750 | val_acc=0.9211
Seed 2 finished: best_val=0.9218, time=2.35 min

=== Summary ===
Seed 0: best_val=0.9199, best_test=0.9199, time=2.37 min
Seed 1: best_val=0.9201, best_test=0.9201, time=2.35 min
Seed 2: best_val=0.9218, best_test=0.9218, time=2.35 min
Submitted real-data baseline for Transformer.
