Using device: cuda
[Seed 0] Epoch 001/100 | train_loss=0.4831 | val_loss=0.3321 | val_acc=0.8821
[Seed 0] Epoch 002/100 | train_loss=0.3010 | val_loss=0.3005 | val_acc=0.8928
[Seed 0] Epoch 003/100 | train_loss=0.2807 | val_loss=0.2866 | val_acc=0.8980
[Seed 0] Epoch 004/100 | train_loss=0.2671 | val_loss=0.2831 | val_acc=0.8988
[Seed 0] Epoch 005/100 | train_loss=0.2582 | val_loss=0.2730 | val_acc=0.9032
[Seed 0] Epoch 006/100 | train_loss=0.2512 | val_loss=0.2737 | val_acc=0.9013
[Seed 0] Epoch 007/100 | train_loss=0.2451 | val_loss=0.2646 | val_acc=0.9055
[Seed 0] Epoch 008/100 | train_loss=0.2384 | val_loss=0.2638 | val_acc=0.9063
[Seed 0] Epoch 009/100 | train_loss=0.2334 | val_loss=0.2583 | val_acc=0.9075
[Seed 0] Epoch 010/100 | train_loss=0.2293 | val_loss=0.2542 | val_acc=0.9109
[Seed 0] Epoch 011/100 | train_loss=0.2243 | val_loss=0.2517 | val_acc=0.9107
[Seed 0] Epoch 012/100 | train_loss=0.2208 | val_loss=0.2498 | val_acc=0.9126
[Seed 0] Epoch 013/100 | train_loss=0.2166 | val_loss=0.2480 | val_acc=0.9124
[Seed 0] Epoch 014/100 | train_loss=0.2111 | val_loss=0.2458 | val_acc=0.9137
[Seed 0] Epoch 015/100 | train_loss=0.2078 | val_loss=0.2425 | val_acc=0.9133
[Seed 0] Epoch 016/100 | train_loss=0.2033 | val_loss=0.2401 | val_acc=0.9153
[Seed 0] Epoch 017/100 | train_loss=0.1992 | val_loss=0.2402 | val_acc=0.9139
[Seed 0] Epoch 018/100 | train_loss=0.1974 | val_loss=0.2382 | val_acc=0.9167
[Seed 0] Epoch 019/100 | train_loss=0.1924 | val_loss=0.2419 | val_acc=0.9172
[Seed 0] Epoch 020/100 | train_loss=0.1887 | val_loss=0.2359 | val_acc=0.9163
[Seed 0] Epoch 021/100 | train_loss=0.1848 | val_loss=0.2345 | val_acc=0.9170
[Seed 0] Epoch 022/100 | train_loss=0.1804 | val_loss=0.2329 | val_acc=0.9186
[Seed 0] Epoch 023/100 | train_loss=0.1770 | val_loss=0.2323 | val_acc=0.9162
[Seed 0] Epoch 024/100 | train_loss=0.1741 | val_loss=0.2328 | val_acc=0.9184
[Seed 0] Epoch 025/100 | train_loss=0.1719 | val_loss=0.2291 | val_acc=0.9186
[Seed 0] Epoch 026/100 | train_loss=0.1678 | val_loss=0.2298 | val_acc=0.9199
[Seed 0] Epoch 027/100 | train_loss=0.1642 | val_loss=0.2304 | val_acc=0.9199
[Seed 0] Epoch 028/100 | train_loss=0.1610 | val_loss=0.2361 | val_acc=0.9183
[Seed 0] Epoch 029/100 | train_loss=0.1610 | val_loss=0.2339 | val_acc=0.9205
[Seed 0] Epoch 030/100 | train_loss=0.1569 | val_loss=0.2296 | val_acc=0.9199
[Seed 0] Epoch 031/100 | train_loss=0.1524 | val_loss=0.2346 | val_acc=0.9183
[Seed 0] Epoch 032/100 | train_loss=0.1491 | val_loss=0.2307 | val_acc=0.9195
[Seed 0] Epoch 033/100 | train_loss=0.1466 | val_loss=0.2322 | val_acc=0.9208
[Seed 0] Epoch 034/100 | train_loss=0.1453 | val_loss=0.2397 | val_acc=0.9170
[Seed 0] Epoch 035/100 | train_loss=0.1418 | val_loss=0.2306 | val_acc=0.9207
[Seed 0] Epoch 036/100 | train_loss=0.1389 | val_loss=0.2315 | val_acc=0.9189
[Seed 0] Epoch 037/100 | train_loss=0.1360 | val_loss=0.2326 | val_acc=0.9207
[Seed 0] Epoch 038/100 | train_loss=0.1340 | val_loss=0.2299 | val_acc=0.9212
[Seed 0] Epoch 039/100 | train_loss=0.1317 | val_loss=0.2296 | val_acc=0.9212
[Seed 0] Epoch 040/100 | train_loss=0.1286 | val_loss=0.2304 | val_acc=0.9211
[Seed 0] Epoch 041/100 | train_loss=0.1254 | val_loss=0.2330 | val_acc=0.9188
[Seed 0] Epoch 042/100 | train_loss=0.1249 | val_loss=0.2292 | val_acc=0.9221
[Seed 0] Epoch 043/100 | train_loss=0.1217 | val_loss=0.2326 | val_acc=0.9208
[Seed 0] Epoch 044/100 | train_loss=0.1185 | val_loss=0.2333 | val_acc=0.9203
[Seed 0] Epoch 045/100 | train_loss=0.1173 | val_loss=0.2342 | val_acc=0.9192
[Seed 0] Epoch 046/100 | train_loss=0.1159 | val_loss=0.2321 | val_acc=0.9217
[Seed 0] Epoch 047/100 | train_loss=0.1131 | val_loss=0.2324 | val_acc=0.9203
[Seed 0] Epoch 048/100 | train_loss=0.1113 | val_loss=0.2366 | val_acc=0.9229
[Seed 0] Epoch 049/100 | train_loss=0.1091 | val_loss=0.2357 | val_acc=0.9224
[Seed 0] Epoch 050/100 | train_loss=0.1075 | val_loss=0.2353 | val_acc=0.9220
[Seed 0] Epoch 051/100 | train_loss=0.1050 | val_loss=0.2385 | val_acc=0.9193
[Seed 0] Epoch 052/100 | train_loss=0.1034 | val_loss=0.2364 | val_acc=0.9222
[Seed 0] Epoch 053/100 | train_loss=0.1026 | val_loss=0.2357 | val_acc=0.9211
[Seed 0] Epoch 054/100 | train_loss=0.1010 | val_loss=0.2365 | val_acc=0.9225
[Seed 0] Epoch 055/100 | train_loss=0.0988 | val_loss=0.2398 | val_acc=0.9222
[Seed 0] Epoch 056/100 | train_loss=0.0983 | val_loss=0.2396 | val_acc=0.9218
[Seed 0] Epoch 057/100 | train_loss=0.0972 | val_loss=0.2418 | val_acc=0.9228
[Seed 0] Epoch 058/100 | train_loss=0.0952 | val_loss=0.2405 | val_acc=0.9214
[Seed 0] Epoch 059/100 | train_loss=0.0932 | val_loss=0.2381 | val_acc=0.9225
[Seed 0] Epoch 060/100 | train_loss=0.0930 | val_loss=0.2376 | val_acc=0.9225
[Seed 0] Epoch 061/100 | train_loss=0.0907 | val_loss=0.2383 | val_acc=0.9229
[Seed 0] Epoch 062/100 | train_loss=0.0888 | val_loss=0.2392 | val_acc=0.9221
[Seed 0] Epoch 063/100 | train_loss=0.0877 | val_loss=0.2427 | val_acc=0.9218
[Seed 0] Epoch 064/100 | train_loss=0.0874 | val_loss=0.2417 | val_acc=0.9204
[Seed 0] Epoch 065/100 | train_loss=0.0856 | val_loss=0.2408 | val_acc=0.9230
[Seed 0] Epoch 066/100 | train_loss=0.0848 | val_loss=0.2417 | val_acc=0.9216
[Seed 0] Epoch 067/100 | train_loss=0.0840 | val_loss=0.2404 | val_acc=0.9221
[Seed 0] Epoch 068/100 | train_loss=0.0828 | val_loss=0.2418 | val_acc=0.9229
[Seed 0] Epoch 069/100 | train_loss=0.0822 | val_loss=0.2419 | val_acc=0.9233
[Seed 0] Epoch 070/100 | train_loss=0.0808 | val_loss=0.2434 | val_acc=0.9224
[Seed 0] Epoch 071/100 | train_loss=0.0804 | val_loss=0.2437 | val_acc=0.9221
[Seed 0] Epoch 072/100 | train_loss=0.0794 | val_loss=0.2418 | val_acc=0.9237
[Seed 0] Epoch 073/100 | train_loss=0.0787 | val_loss=0.2426 | val_acc=0.9217
[Seed 0] Epoch 074/100 | train_loss=0.0781 | val_loss=0.2438 | val_acc=0.9220
[Seed 0] Epoch 075/100 | train_loss=0.0773 | val_loss=0.2430 | val_acc=0.9224
[Seed 0] Epoch 076/100 | train_loss=0.0766 | val_loss=0.2438 | val_acc=0.9238
[Seed 0] Epoch 077/100 | train_loss=0.0761 | val_loss=0.2436 | val_acc=0.9230
[Seed 0] Epoch 078/100 | train_loss=0.0758 | val_loss=0.2433 | val_acc=0.9221
[Seed 0] Epoch 079/100 | train_loss=0.0753 | val_loss=0.2437 | val_acc=0.9230
[Seed 0] Epoch 080/100 | train_loss=0.0749 | val_loss=0.2463 | val_acc=0.9204
[Seed 0] Epoch 081/100 | train_loss=0.0742 | val_loss=0.2458 | val_acc=0.9221
[Seed 0] Epoch 082/100 | train_loss=0.0738 | val_loss=0.2445 | val_acc=0.9217
[Seed 0] Epoch 083/100 | train_loss=0.0734 | val_loss=0.2451 | val_acc=0.9232
[Seed 0] Epoch 084/100 | train_loss=0.0732 | val_loss=0.2457 | val_acc=0.9217
[Seed 0] Epoch 085/100 | train_loss=0.0728 | val_loss=0.2449 | val_acc=0.9226
[Seed 0] Epoch 086/100 | train_loss=0.0726 | val_loss=0.2455 | val_acc=0.9228
[Seed 0] Epoch 087/100 | train_loss=0.0723 | val_loss=0.2456 | val_acc=0.9224
[Seed 0] Epoch 088/100 | train_loss=0.0720 | val_loss=0.2453 | val_acc=0.9220
[Seed 0] Epoch 089/100 | train_loss=0.0718 | val_loss=0.2462 | val_acc=0.9207
[Seed 0] Epoch 090/100 | train_loss=0.0716 | val_loss=0.2454 | val_acc=0.9221
[Seed 0] Epoch 091/100 | train_loss=0.0714 | val_loss=0.2459 | val_acc=0.9225
[Seed 0] Epoch 092/100 | train_loss=0.0713 | val_loss=0.2459 | val_acc=0.9220
[Seed 0] Epoch 093/100 | train_loss=0.0712 | val_loss=0.2461 | val_acc=0.9221
[Seed 0] Epoch 094/100 | train_loss=0.0711 | val_loss=0.2459 | val_acc=0.9221
[Seed 0] Epoch 095/100 | train_loss=0.0710 | val_loss=0.2459 | val_acc=0.9222
[Seed 0] Epoch 096/100 | train_loss=0.0709 | val_loss=0.2459 | val_acc=0.9222
[Seed 0] Epoch 097/100 | train_loss=0.0709 | val_loss=0.2459 | val_acc=0.9220
[Seed 0] Epoch 098/100 | train_loss=0.0708 | val_loss=0.2459 | val_acc=0.9221
[Seed 0] Epoch 099/100 | train_loss=0.0708 | val_loss=0.2459 | val_acc=0.9221
[Seed 0] Epoch 100/100 | train_loss=0.0708 | val_loss=0.2459 | val_acc=0.9221
Seed 0 finished: best_val=0.9238, time=1.05 min
[Seed 1] Epoch 001/100 | train_loss=0.4854 | val_loss=0.3353 | val_acc=0.8830
[Seed 1] Epoch 002/100 | train_loss=0.3027 | val_loss=0.3003 | val_acc=0.8928
[Seed 1] Epoch 003/100 | train_loss=0.2798 | val_loss=0.2861 | val_acc=0.8970
[Seed 1] Epoch 004/100 | train_loss=0.2663 | val_loss=0.2813 | val_acc=0.9001
[Seed 1] Epoch 005/100 | train_loss=0.2598 | val_loss=0.2775 | val_acc=0.9005
[Seed 1] Epoch 006/100 | train_loss=0.2519 | val_loss=0.2699 | val_acc=0.9021
[Seed 1] Epoch 007/100 | train_loss=0.2451 | val_loss=0.2666 | val_acc=0.9054
[Seed 1] Epoch 008/100 | train_loss=0.2404 | val_loss=0.2616 | val_acc=0.9082
[Seed 1] Epoch 009/100 | train_loss=0.2347 | val_loss=0.2556 | val_acc=0.9095
[Seed 1] Epoch 010/100 | train_loss=0.2302 | val_loss=0.2618 | val_acc=0.9064
[Seed 1] Epoch 011/100 | train_loss=0.2265 | val_loss=0.2498 | val_acc=0.9121
[Seed 1] Epoch 012/100 | train_loss=0.2205 | val_loss=0.2482 | val_acc=0.9139
[Seed 1] Epoch 013/100 | train_loss=0.2166 | val_loss=0.2448 | val_acc=0.9137
[Seed 1] Epoch 014/100 | train_loss=0.2122 | val_loss=0.2448 | val_acc=0.9149
[Seed 1] Epoch 015/100 | train_loss=0.2082 | val_loss=0.2453 | val_acc=0.9141
[Seed 1] Epoch 016/100 | train_loss=0.2047 | val_loss=0.2398 | val_acc=0.9170
[Seed 1] Epoch 017/100 | train_loss=0.2006 | val_loss=0.2404 | val_acc=0.9164
[Seed 1] Epoch 018/100 | train_loss=0.1971 | val_loss=0.2362 | val_acc=0.9178
[Seed 1] Epoch 019/100 | train_loss=0.1929 | val_loss=0.2354 | val_acc=0.9180
[Seed 1] Epoch 020/100 | train_loss=0.1898 | val_loss=0.2349 | val_acc=0.9196
[Seed 1] Epoch 021/100 | train_loss=0.1864 | val_loss=0.2356 | val_acc=0.9179
[Seed 1] Epoch 022/100 | train_loss=0.1848 | val_loss=0.2328 | val_acc=0.9196
[Seed 1] Epoch 023/100 | train_loss=0.1798 | val_loss=0.2316 | val_acc=0.9218
[Seed 1] Epoch 024/100 | train_loss=0.1773 | val_loss=0.2375 | val_acc=0.9170
[Seed 1] Epoch 025/100 | train_loss=0.1749 | val_loss=0.2373 | val_acc=0.9151
[Seed 1] Epoch 026/100 | train_loss=0.1705 | val_loss=0.2350 | val_acc=0.9189
[Seed 1] Epoch 027/100 | train_loss=0.1691 | val_loss=0.2321 | val_acc=0.9189
[Seed 1] Epoch 028/100 | train_loss=0.1664 | val_loss=0.2291 | val_acc=0.9203
[Seed 1] Epoch 029/100 | train_loss=0.1617 | val_loss=0.2310 | val_acc=0.9191
[Seed 1] Epoch 030/100 | train_loss=0.1598 | val_loss=0.2330 | val_acc=0.9201
[Seed 1] Epoch 031/100 | train_loss=0.1564 | val_loss=0.2296 | val_acc=0.9195
[Seed 1] Epoch 032/100 | train_loss=0.1526 | val_loss=0.2298 | val_acc=0.9209
[Seed 1] Epoch 033/100 | train_loss=0.1516 | val_loss=0.2291 | val_acc=0.9201
[Seed 1] Epoch 034/100 | train_loss=0.1483 | val_loss=0.2278 | val_acc=0.9229
[Seed 1] Epoch 035/100 | train_loss=0.1445 | val_loss=0.2298 | val_acc=0.9214
[Seed 1] Epoch 036/100 | train_loss=0.1440 | val_loss=0.2323 | val_acc=0.9199
[Seed 1] Epoch 037/100 | train_loss=0.1402 | val_loss=0.2321 | val_acc=0.9189
[Seed 1] Epoch 038/100 | train_loss=0.1388 | val_loss=0.2309 | val_acc=0.9208
[Seed 1] Epoch 039/100 | train_loss=0.1356 | val_loss=0.2289 | val_acc=0.9229
[Seed 1] Epoch 040/100 | train_loss=0.1322 | val_loss=0.2306 | val_acc=0.9209
[Seed 1] Epoch 041/100 | train_loss=0.1304 | val_loss=0.2270 | val_acc=0.9212
[Seed 1] Epoch 042/100 | train_loss=0.1273 | val_loss=0.2274 | val_acc=0.9225
[Seed 1] Epoch 043/100 | train_loss=0.1258 | val_loss=0.2296 | val_acc=0.9208
[Seed 1] Epoch 044/100 | train_loss=0.1236 | val_loss=0.2318 | val_acc=0.9212
[Seed 1] Epoch 045/100 | train_loss=0.1212 | val_loss=0.2299 | val_acc=0.9212
[Seed 1] Epoch 046/100 | train_loss=0.1191 | val_loss=0.2329 | val_acc=0.9212
[Seed 1] Epoch 047/100 | train_loss=0.1172 | val_loss=0.2303 | val_acc=0.9218
[Seed 1] Epoch 048/100 | train_loss=0.1139 | val_loss=0.2300 | val_acc=0.9229
[Seed 1] Epoch 049/100 | train_loss=0.1136 | val_loss=0.2330 | val_acc=0.9220
[Seed 1] Epoch 050/100 | train_loss=0.1102 | val_loss=0.2309 | val_acc=0.9228
[Seed 1] Epoch 051/100 | train_loss=0.1096 | val_loss=0.2298 | val_acc=0.9218
[Seed 1] Epoch 052/100 | train_loss=0.1075 | val_loss=0.2311 | val_acc=0.9205
[Seed 1] Epoch 053/100 | train_loss=0.1055 | val_loss=0.2382 | val_acc=0.9195
[Seed 1] Epoch 054/100 | train_loss=0.1039 | val_loss=0.2346 | val_acc=0.9217
[Seed 1] Epoch 055/100 | train_loss=0.1020 | val_loss=0.2330 | val_acc=0.9209
[Seed 1] Epoch 056/100 | train_loss=0.1008 | val_loss=0.2317 | val_acc=0.9213
[Seed 1] Epoch 057/100 | train_loss=0.0993 | val_loss=0.2338 | val_acc=0.9234
[Seed 1] Epoch 058/100 | train_loss=0.0981 | val_loss=0.2349 | val_acc=0.9196
[Seed 1] Epoch 059/100 | train_loss=0.0964 | val_loss=0.2343 | val_acc=0.9213
[Seed 1] Epoch 060/100 | train_loss=0.0953 | val_loss=0.2356 | val_acc=0.9221
[Seed 1] Epoch 061/100 | train_loss=0.0936 | val_loss=0.2347 | val_acc=0.9220
[Seed 1] Epoch 062/100 | train_loss=0.0918 | val_loss=0.2352 | val_acc=0.9228
[Seed 1] Epoch 063/100 | train_loss=0.0908 | val_loss=0.2369 | val_acc=0.9205
[Seed 1] Epoch 064/100 | train_loss=0.0896 | val_loss=0.2363 | val_acc=0.9214
[Seed 1] Epoch 065/100 | train_loss=0.0887 | val_loss=0.2366 | val_acc=0.9213
[Seed 1] Epoch 066/100 | train_loss=0.0880 | val_loss=0.2399 | val_acc=0.9197
[Seed 1] Epoch 067/100 | train_loss=0.0874 | val_loss=0.2371 | val_acc=0.9229
[Seed 1] Epoch 068/100 | train_loss=0.0859 | val_loss=0.2385 | val_acc=0.9221
[Seed 1] Epoch 069/100 | train_loss=0.0846 | val_loss=0.2390 | val_acc=0.9216
[Seed 1] Epoch 070/100 | train_loss=0.0838 | val_loss=0.2390 | val_acc=0.9217
[Seed 1] Epoch 071/100 | train_loss=0.0832 | val_loss=0.2394 | val_acc=0.9213
[Seed 1] Epoch 072/100 | train_loss=0.0822 | val_loss=0.2382 | val_acc=0.9208
[Seed 1] Epoch 073/100 | train_loss=0.0815 | val_loss=0.2393 | val_acc=0.9217
[Seed 1] Epoch 074/100 | train_loss=0.0808 | val_loss=0.2410 | val_acc=0.9217
[Seed 1] Epoch 075/100 | train_loss=0.0802 | val_loss=0.2398 | val_acc=0.9220
[Seed 1] Epoch 076/100 | train_loss=0.0794 | val_loss=0.2408 | val_acc=0.9214
[Seed 1] Epoch 077/100 | train_loss=0.0789 | val_loss=0.2399 | val_acc=0.9200
[Seed 1] Epoch 078/100 | train_loss=0.0784 | val_loss=0.2413 | val_acc=0.9201
[Seed 1] Epoch 079/100 | train_loss=0.0778 | val_loss=0.2401 | val_acc=0.9209
[Seed 1] Epoch 080/100 | train_loss=0.0774 | val_loss=0.2413 | val_acc=0.9211
[Seed 1] Epoch 081/100 | train_loss=0.0768 | val_loss=0.2413 | val_acc=0.9208
[Seed 1] Epoch 082/100 | train_loss=0.0764 | val_loss=0.2412 | val_acc=0.9205
[Seed 1] Epoch 083/100 | train_loss=0.0762 | val_loss=0.2411 | val_acc=0.9199
[Seed 1] Epoch 084/100 | train_loss=0.0756 | val_loss=0.2414 | val_acc=0.9216
[Seed 1] Epoch 085/100 | train_loss=0.0754 | val_loss=0.2417 | val_acc=0.9205
[Seed 1] Epoch 086/100 | train_loss=0.0751 | val_loss=0.2426 | val_acc=0.9209
[Seed 1] Epoch 087/100 | train_loss=0.0749 | val_loss=0.2418 | val_acc=0.9208
[Seed 1] Epoch 088/100 | train_loss=0.0745 | val_loss=0.2420 | val_acc=0.9204
[Seed 1] Epoch 089/100 | train_loss=0.0744 | val_loss=0.2418 | val_acc=0.9203
[Seed 1] Epoch 090/100 | train_loss=0.0741 | val_loss=0.2419 | val_acc=0.9211
[Seed 1] Epoch 091/100 | train_loss=0.0740 | val_loss=0.2418 | val_acc=0.9205
[Seed 1] Epoch 092/100 | train_loss=0.0738 | val_loss=0.2420 | val_acc=0.9201
[Seed 1] Epoch 093/100 | train_loss=0.0737 | val_loss=0.2420 | val_acc=0.9208
[Seed 1] Epoch 094/100 | train_loss=0.0736 | val_loss=0.2420 | val_acc=0.9211
[Seed 1] Epoch 095/100 | train_loss=0.0735 | val_loss=0.2420 | val_acc=0.9211
[Seed 1] Epoch 096/100 | train_loss=0.0734 | val_loss=0.2421 | val_acc=0.9211
[Seed 1] Epoch 097/100 | train_loss=0.0734 | val_loss=0.2421 | val_acc=0.9209
[Seed 1] Epoch 098/100 | train_loss=0.0734 | val_loss=0.2421 | val_acc=0.9209
[Seed 1] Epoch 099/100 | train_loss=0.0733 | val_loss=0.2421 | val_acc=0.9209
[Seed 1] Epoch 100/100 | train_loss=0.0733 | val_loss=0.2421 | val_acc=0.9209
Seed 1 finished: best_val=0.9234, time=1.03 min
[Seed 2] Epoch 001/100 | train_loss=0.4822 | val_loss=0.3311 | val_acc=0.8851
[Seed 2] Epoch 002/100 | train_loss=0.3015 | val_loss=0.2995 | val_acc=0.8928
[Seed 2] Epoch 003/100 | train_loss=0.2798 | val_loss=0.2885 | val_acc=0.8971
[Seed 2] Epoch 004/100 | train_loss=0.2690 | val_loss=0.2808 | val_acc=0.9007
[Seed 2] Epoch 005/100 | train_loss=0.2620 | val_loss=0.2742 | val_acc=0.8997
[Seed 2] Epoch 006/100 | train_loss=0.2539 | val_loss=0.2744 | val_acc=0.9038
[Seed 2] Epoch 007/100 | train_loss=0.2486 | val_loss=0.2727 | val_acc=0.9038
[Seed 2] Epoch 008/100 | train_loss=0.2431 | val_loss=0.2670 | val_acc=0.9054
[Seed 2] Epoch 009/100 | train_loss=0.2383 | val_loss=0.2606 | val_acc=0.9066
[Seed 2] Epoch 010/100 | train_loss=0.2348 | val_loss=0.2560 | val_acc=0.9092
[Seed 2] Epoch 011/100 | train_loss=0.2298 | val_loss=0.2545 | val_acc=0.9084
[Seed 2] Epoch 012/100 | train_loss=0.2253 | val_loss=0.2588 | val_acc=0.9095
[Seed 2] Epoch 013/100 | train_loss=0.2215 | val_loss=0.2507 | val_acc=0.9103
[Seed 2] Epoch 014/100 | train_loss=0.2161 | val_loss=0.2468 | val_acc=0.9133
[Seed 2] Epoch 015/100 | train_loss=0.2127 | val_loss=0.2456 | val_acc=0.9128
[Seed 2] Epoch 016/100 | train_loss=0.2083 | val_loss=0.2409 | val_acc=0.9136
[Seed 2] Epoch 017/100 | train_loss=0.2036 | val_loss=0.2410 | val_acc=0.9154
[Seed 2] Epoch 018/100 | train_loss=0.2001 | val_loss=0.2379 | val_acc=0.9162
[Seed 2] Epoch 019/100 | train_loss=0.1958 | val_loss=0.2376 | val_acc=0.9164
[Seed 2] Epoch 020/100 | train_loss=0.1924 | val_loss=0.2375 | val_acc=0.9147
[Seed 2] Epoch 021/100 | train_loss=0.1875 | val_loss=0.2362 | val_acc=0.9186
[Seed 2] Epoch 022/100 | train_loss=0.1840 | val_loss=0.2322 | val_acc=0.9167
[Seed 2] Epoch 023/100 | train_loss=0.1804 | val_loss=0.2289 | val_acc=0.9192
[Seed 2] Epoch 024/100 | train_loss=0.1784 | val_loss=0.2296 | val_acc=0.9192
[Seed 2] Epoch 025/100 | train_loss=0.1726 | val_loss=0.2296 | val_acc=0.9182
[Seed 2] Epoch 026/100 | train_loss=0.1700 | val_loss=0.2323 | val_acc=0.9178
[Seed 2] Epoch 027/100 | train_loss=0.1675 | val_loss=0.2284 | val_acc=0.9211
[Seed 2] Epoch 028/100 | train_loss=0.1638 | val_loss=0.2281 | val_acc=0.9196
[Seed 2] Epoch 029/100 | train_loss=0.1602 | val_loss=0.2264 | val_acc=0.9213
[Seed 2] Epoch 030/100 | train_loss=0.1579 | val_loss=0.2263 | val_acc=0.9200
[Seed 2] Epoch 031/100 | train_loss=0.1541 | val_loss=0.2337 | val_acc=0.9193
[Seed 2] Epoch 032/100 | train_loss=0.1520 | val_loss=0.2298 | val_acc=0.9178
[Seed 2] Epoch 033/100 | train_loss=0.1495 | val_loss=0.2286 | val_acc=0.9191
[Seed 2] Epoch 034/100 | train_loss=0.1445 | val_loss=0.2259 | val_acc=0.9221
[Seed 2] Epoch 035/100 | train_loss=0.1433 | val_loss=0.2247 | val_acc=0.9225
[Seed 2] Epoch 036/100 | train_loss=0.1392 | val_loss=0.2286 | val_acc=0.9222
[Seed 2] Epoch 037/100 | train_loss=0.1365 | val_loss=0.2284 | val_acc=0.9208
[Seed 2] Epoch 038/100 | train_loss=0.1349 | val_loss=0.2279 | val_acc=0.9209
[Seed 2] Epoch 039/100 | train_loss=0.1318 | val_loss=0.2251 | val_acc=0.9245
[Seed 2] Epoch 040/100 | train_loss=0.1311 | val_loss=0.2289 | val_acc=0.9236
[Seed 2] Epoch 041/100 | train_loss=0.1274 | val_loss=0.2313 | val_acc=0.9204
[Seed 2] Epoch 042/100 | train_loss=0.1252 | val_loss=0.2295 | val_acc=0.9209
[Seed 2] Epoch 043/100 | train_loss=0.1230 | val_loss=0.2296 | val_acc=0.9211
[Seed 2] Epoch 044/100 | train_loss=0.1203 | val_loss=0.2269 | val_acc=0.9232
[Seed 2] Epoch 045/100 | train_loss=0.1182 | val_loss=0.2298 | val_acc=0.9228
[Seed 2] Epoch 046/100 | train_loss=0.1156 | val_loss=0.2343 | val_acc=0.9236
[Seed 2] Epoch 047/100 | train_loss=0.1146 | val_loss=0.2339 | val_acc=0.9220
[Seed 2] Epoch 048/100 | train_loss=0.1126 | val_loss=0.2338 | val_acc=0.9222
[Seed 2] Epoch 049/100 | train_loss=0.1104 | val_loss=0.2333 | val_acc=0.9232
[Seed 2] Epoch 050/100 | train_loss=0.1091 | val_loss=0.2343 | val_acc=0.9226
[Seed 2] Epoch 051/100 | train_loss=0.1056 | val_loss=0.2327 | val_acc=0.9232
[Seed 2] Epoch 052/100 | train_loss=0.1044 | val_loss=0.2357 | val_acc=0.9212
[Seed 2] Epoch 053/100 | train_loss=0.1036 | val_loss=0.2320 | val_acc=0.9234
[Seed 2] Epoch 054/100 | train_loss=0.1005 | val_loss=0.2340 | val_acc=0.9232
[Seed 2] Epoch 055/100 | train_loss=0.1001 | val_loss=0.2364 | val_acc=0.9212
[Seed 2] Epoch 056/100 | train_loss=0.0991 | val_loss=0.2357 | val_acc=0.9213
[Seed 2] Epoch 057/100 | train_loss=0.0966 | val_loss=0.2349 | val_acc=0.9225
[Seed 2] Epoch 058/100 | train_loss=0.0951 | val_loss=0.2344 | val_acc=0.9217
[Seed 2] Epoch 059/100 | train_loss=0.0934 | val_loss=0.2380 | val_acc=0.9234
[Seed 2] Epoch 060/100 | train_loss=0.0925 | val_loss=0.2352 | val_acc=0.9221
[Seed 2] Epoch 061/100 | train_loss=0.0912 | val_loss=0.2375 | val_acc=0.9226
[Seed 2] Epoch 062/100 | train_loss=0.0898 | val_loss=0.2367 | val_acc=0.9213
[Seed 2] Epoch 063/100 | train_loss=0.0886 | val_loss=0.2361 | val_acc=0.9229
[Seed 2] Epoch 064/100 | train_loss=0.0882 | val_loss=0.2355 | val_acc=0.9226
[Seed 2] Epoch 065/100 | train_loss=0.0865 | val_loss=0.2386 | val_acc=0.9222
[Seed 2] Epoch 066/100 | train_loss=0.0853 | val_loss=0.2382 | val_acc=0.9230
[Seed 2] Epoch 067/100 | train_loss=0.0844 | val_loss=0.2397 | val_acc=0.9218
[Seed 2] Epoch 068/100 | train_loss=0.0839 | val_loss=0.2403 | val_acc=0.9204
[Seed 2] Epoch 069/100 | train_loss=0.0828 | val_loss=0.2382 | val_acc=0.9220
[Seed 2] Epoch 070/100 | train_loss=0.0814 | val_loss=0.2392 | val_acc=0.9214
[Seed 2] Epoch 071/100 | train_loss=0.0814 | val_loss=0.2397 | val_acc=0.9220
[Seed 2] Epoch 072/100 | train_loss=0.0801 | val_loss=0.2388 | val_acc=0.9221
[Seed 2] Epoch 073/100 | train_loss=0.0796 | val_loss=0.2403 | val_acc=0.9226
[Seed 2] Epoch 074/100 | train_loss=0.0788 | val_loss=0.2401 | val_acc=0.9218
[Seed 2] Epoch 075/100 | train_loss=0.0784 | val_loss=0.2423 | val_acc=0.9216
[Seed 2] Epoch 076/100 | train_loss=0.0775 | val_loss=0.2415 | val_acc=0.9237
[Seed 2] Epoch 077/100 | train_loss=0.0768 | val_loss=0.2407 | val_acc=0.9216
[Seed 2] Epoch 078/100 | train_loss=0.0765 | val_loss=0.2418 | val_acc=0.9225
[Seed 2] Epoch 079/100 | train_loss=0.0760 | val_loss=0.2411 | val_acc=0.9222
[Seed 2] Epoch 080/100 | train_loss=0.0754 | val_loss=0.2409 | val_acc=0.9217
[Seed 2] Epoch 081/100 | train_loss=0.0750 | val_loss=0.2422 | val_acc=0.9220
[Seed 2] Epoch 082/100 | train_loss=0.0745 | val_loss=0.2434 | val_acc=0.9228
[Seed 2] Epoch 083/100 | train_loss=0.0743 | val_loss=0.2420 | val_acc=0.9220
[Seed 2] Epoch 084/100 | train_loss=0.0737 | val_loss=0.2418 | val_acc=0.9211
[Seed 2] Epoch 085/100 | train_loss=0.0736 | val_loss=0.2421 | val_acc=0.9216
[Seed 2] Epoch 086/100 | train_loss=0.0732 | val_loss=0.2424 | val_acc=0.9221
[Seed 2] Epoch 087/100 | train_loss=0.0729 | val_loss=0.2425 | val_acc=0.9222
[Seed 2] Epoch 088/100 | train_loss=0.0727 | val_loss=0.2425 | val_acc=0.9220
[Seed 2] Epoch 089/100 | train_loss=0.0725 | val_loss=0.2428 | val_acc=0.9225
[Seed 2] Epoch 090/100 | train_loss=0.0723 | val_loss=0.2427 | val_acc=0.9213
[Seed 2] Epoch 091/100 | train_loss=0.0722 | val_loss=0.2427 | val_acc=0.9221
[Seed 2] Epoch 092/100 | train_loss=0.0720 | val_loss=0.2427 | val_acc=0.9224
[Seed 2] Epoch 093/100 | train_loss=0.0719 | val_loss=0.2428 | val_acc=0.9224
[Seed 2] Epoch 094/100 | train_loss=0.0718 | val_loss=0.2429 | val_acc=0.9226
[Seed 2] Epoch 095/100 | train_loss=0.0717 | val_loss=0.2428 | val_acc=0.9216
[Seed 2] Epoch 096/100 | train_loss=0.0716 | val_loss=0.2428 | val_acc=0.9220
[Seed 2] Epoch 097/100 | train_loss=0.0716 | val_loss=0.2427 | val_acc=0.9218
[Seed 2] Epoch 098/100 | train_loss=0.0715 | val_loss=0.2428 | val_acc=0.9222
[Seed 2] Epoch 099/100 | train_loss=0.0715 | val_loss=0.2427 | val_acc=0.9221
[Seed 2] Epoch 100/100 | train_loss=0.0715 | val_loss=0.2427 | val_acc=0.9220
Seed 2 finished: best_val=0.9245, time=1.06 min

=== Summary ===
Seed 0: best_val=0.9238, best_test=0.9238, time=1.05 min
Seed 1: best_val=0.9234, best_test=0.9234, time=1.03 min
Seed 2: best_val=0.9245, best_test=0.9245, time=1.06 min
Submitted real-data baseline for MLP.
